{
  "$schema": "https://json-schema.org/draft/2020-12/schema",
  "title": "Scenario context v1",
  "type": "object",
  "properties": {
    "schemaVersion": {
      "const": "1.0"
    },
    "entities": {
      "type": "array",
      "items": {
        "type": "object",
        "properties": {
          "id": {
            "type": "string",
            "minLength": 1,
            "maxLength": 80,
            "pattern": "^[a-z][a-z0-9_-]*$"
          },
          "type": {
            "type": [
              "string",
              "null"
            ],
            "maxLength": 80
          }
        },
        "required": [
          "id",
          "type"
        ],
        "additionalProperties": false
      },
      "minItems": 0,
      "maxItems": 256
    },
    "vulnerabilities": {
      "type": "array",
      "items": {
        "type": "object",
        "properties": {
          "predicate": {
            "type": "string",
            "minLength": 1,
            "maxLength": 80,
            "pattern": "^[a-z][a-z0-9_-]*$"
          },
          "args": {
            "type": "array",
            "items": {
              "type": "string",
              "minLength": 1,
              "maxLength": 80,
              "pattern": "^[a-z][a-z0-9_-]*$"
            },
            "minItems": 1,
            "maxItems": 8
          },
          "value": {
            "type": [
              "boolean",
              "null"
            ]
          }
        },
        "required": [
          "predicate",
          "args",
          "value"
        ],
        "additionalProperties": false
      },
      "minItems": 0,
      "maxItems": 1024
    },
    "attackerInitialPrivileges": {
      "type": "array",
      "items": {
        "type": "object",
        "properties": {
          "predicate": {
            "type": "string",
            "minLength": 1,
            "maxLength": 80,
            "pattern": "^[a-z][a-z0-9_-]*$"
          },
          "args": {
            "type": "array",
            "items": {
              "type": "string",
              "minLength": 1,
              "maxLength": 80,
              "pattern": "^[a-z][a-z0-9_-]*$"
            },
            "minItems": 1,
            "maxItems": 8
          },
          "value": {
            "type": [
              "boolean",
              "null"
            ]
          }
        },
        "required": [
          "predicate",
          "args",
          "value"
        ],
        "additionalProperties": false
      },
      "minItems": 0,
      "maxItems": 1024
    },
    "requiredUserActions": {
      "type": "array",
      "items": {
        "type": "object",
        "properties": {
          "predicate": {
            "type": "string",
            "minLength": 1,
            "maxLength": 80,
            "pattern": "^[a-z][a-z0-9_-]*$"
          },
          "args": {
            "type": "array",
            "items": {
              "type": "string",
              "minLength": 1,
              "maxLength": 80,
              "pattern": "^[a-z][a-z0-9_-]*$"
            },
            "minItems": 1,
            "maxItems": 8
          },
          "value": {
            "type": [
              "boolean",
              "null"
            ]
          }
        },
        "required": [
          "predicate",
          "args",
          "value"
        ],
        "additionalProperties": false
      },
      "minItems": 0,
      "maxItems": 1024
    },
    "loggingConfiguration": {
      "type": "array",
      "items": {
        "type": "object",
        "properties": {
          "predicate": {
            "type": "string",
            "minLength": 1,
            "maxLength": 80,
            "pattern": "^[a-z][a-z0-9_-]*$"
          },
          "args": {
            "type": "array",
            "items": {
              "type": "string",
              "minLength": 1,
              "maxLength": 80,
              "pattern": "^[a-z][a-z0-9_-]*$"
            },
            "minItems": 1,
            "maxItems": 8
          },
          "value": {
            "type": [
              "boolean",
              "null"
            ]
          }
        },
        "required": [
          "predicate",
          "args",
          "value"
        ],
        "additionalProperties": false
      },
      "minItems": 0,
      "maxItems": 1024
    },
    "authenticationConditions": {
      "type": "array",
      "items": {
        "type": "object",
        "properties": {
          "predicate": {
            "type": "string",
            "minLength": 1,
            "maxLength": 80,
            "pattern": "^[a-z][a-z0-9_-]*$"
          },
          "args": {
            "type": "array",
            "items": {
              "type": "string",
              "minLength": 1,
              "maxLength": 80,
              "pattern": "^[a-z][a-z0-9_-]*$"
            },
            "minItems": 1,
            "maxItems": 8
          },
          "value": {
            "type": [
              "boolean",
              "null"
            ]
          }
        },
        "required": [
          "predicate",
          "args",
          "value"
        ],
        "additionalProperties": false
      },
      "minItems": 0,
      "maxItems": 1024
    },
    "otherConditions": {
      "type": "array",
      "items": {
        "type": "object",
        "properties": {
          "predicate": {
            "type": "string",
            "minLength": 1,
            "maxLength": 80,
            "pattern": "^[a-z][a-z0-9_-]*$"
          },
          "args": {
            "type": "array",
            "items": {
              "type": "string",
              "minLength": 1,
              "maxLength": 80,
              "pattern": "^[a-z][a-z0-9_-]*$"
            },
            "minItems": 1,
            "maxItems": 8
          },
          "value": {
            "type": [
              "boolean",
              "null"
            ]
          }
        },
        "required": [
          "predicate",
          "args",
          "value"
        ],
        "additionalProperties": false
      },
      "minItems": 0,
      "maxItems": 1024
    }
  },
  "required": [
    "schemaVersion",
    "entities",
    "vulnerabilities",
    "attackerInitialPrivileges",
    "requiredUserActions",
    "loggingConfiguration",
    "authenticationConditions",
    "otherConditions"
  ],
  "additionalProperties": false
}
